{"schema_version":1,"scope":{"owner_ref":"owner:synthetic","account_ref":"account:synthetic","chat_ref":"chat:synthetic","provider_message_ref":"message:synthetic"},"claims":[{"kind":"extracted","statement":"SYNTHETIC astronomy note.","citations":[{"source_ref":"source:synthetic","start":0,"end":25}]}],"unknowns":[],"contradictions":[]}
