{"schema_version":1,"scope":{"owner_ref":"owner:synthetic","account_ref":"account:synthetic","chat_ref":"chat:synthetic","provider_message_ref":"message:synthetic"},"claims":[{"kind":"inference","statement":"SYNTHETIC sources disagree.","citations":[{"source_ref":"source:first","start":0,"end":10},{"source_ref":"source:second","start":0,"end":11}]}],"unknowns":["SYNTHETIC date is uncertain."],"contradictions":[{"description":"SYNTHETIC incompatible declarations.","source_refs":["source:first","source:second"]}]}
